[
  {
    "source_id": "nice-surgical-site-infections-ng125-2023",
    "table_id": "nice-surgical-site-infections-ng125-2023-table-1",
    "table_title": null,
    "page_or_html_location": {
      "resolved_url": "https://www.nice.org.uk/guidance/ng125/chapter/recommendations",
      "anchor": null,
      "heading_path": [
        "Surgical site infections: prevention and treatment",
        "Recommendations",
        "1.3 Intraoperative phase",
        "Antiseptic skin preparation",
        "1.3.9"
      ]
    },
    "headers": [
      "When",
      "Choice of antiseptic skin preparation"
    ],
    "rows": [
      [
        "First choice unless contraindicated or the surgical site is next to a mucous membrane",
        "Alcohol-based solution of chlorhexidine"
      ],
      [
        "Alternative if the surgical site is next to a mucous membrane",
        "Aqueous solution of chlorhexidine"
      ],
      [
        "Alternative if chlorhexidine is contraindicated",
        "Alcohol-based solution of povidone-iodine"
      ],
      [
        "If both an alcohol-based solution and chlorhexidine are unsuitable",
        "Aqueous solution of povidone-iodine"
      ]
    ],
    "footnotes": [],
    "extraction_method": "html-table-dom-regex",
    "extraction_confidence": "high",
    "table_fingerprint": "45204392576dfd9d84fce753bff397a40922c9f9d2edae990735aba56d2c38ba"
  }
]
